title,price,description,category,image_urls,name_variations,values_variations,price_variations
Alloy Bell and Dorjee,2404.33," In Tibetan Buddhism, Dorje/Vajra “method"" and Bell “wisdom” signifies the union of duality such as
bliss and emptiness, compassion and wisdom, male and female, etc. these bells are also very
significant in the Hindu religion where the bells have different cultural significance differing
from place to place. Size (Height x Diameter) chart Small 5.5"" x 2.5"" Medium 6"" x 3"" Large 6.6"" x
3.4"" *approximately",Tibetan Buddhist Instruments & Covers,"http://cdn.shopify.com/s/files/1/0481/5326/4285/products/Alloy_Bell_and_Dorjee-_Small_Medium_Big-01_1024x1024.jpg?v=1600873203, http://cdn.shopify.com/s/files/1/0481/5326/4285/products/IMG-20210830-WA0018-01_1024x1024.jpg?v=1630318942",Size,"Small, Medium, Large","Small: 2404.33, Medium: 2404.33, Large: 2404.33"
