title,cost,description,img_src,photo_desc_str,category
Regulador MPPT Blue Solar 100V 50A VICTRON,"395,96"," Regulador MPPT Blue Solar 100V 50A VICTRON Ver ficha técnica del regulador Victron MPPT Bluesolar
100V 50A Descargar manual regulador de carga MPPT Victron 100V 50A El Regulador MPPT Blue Solar 100V
50A VICTRON es capaz de alcanzar una corriente de carga de hasta 50Ay una tensión de placas
fotovoltaicas de hasta 100V. ¿Que es un regulador de carga? ¿y en qué se diferencia un regulador
MPPT? El Regulador MPPT Blue Solar 100V 50A VICTRON, es capaz de cargar una batería con una tensión
nominal inferior a partir de las placas fotovoltaicas que tengan una tensión nominal superior. El
Regulador MPPT Blue Solar 100V 50A VICTRON ajusta automáticamente la tensión nominal de la batería a
12 ó 24V es decir, que no debemos preocuparnos si tenemos una instalación solar con baterías a 12 ó
24V, ya que el Regulador MPPT Blue Solar 100V 50A VICTRON será capaz de detectarlo automáticamente.
Cuando las condiciones climatológicas son adversas, con nubes o lluvia, la intensidad de la luz
cambia continuamente, con el Regulador MPPT Blue Solar 100V 50A VICTRON podremos adaptarnos a las
nuevas situaciones que se nos presenten en cada momento de una forma rápida y eficiente. Detección
avanzada del punto de máxima potencia MPPT Blue Solar 100V 50A VICTRON Cuando la intensidad de la
luz no es constante, el Regulador MPPT Blue Solar 100V 50A VICTRON mejora la recogida de energía en
hasta un 30% respecto a un controlador PWM e incluso un 10% respecto a otros MPPT. Incorpora un
algoritmo para maximizar siempre la recogida de energía alcanzando el punto de máxima potencia
óptimo para dicho momento. El Regulador MPPT Blue Solar 100V 50A VICTRON tiene una eficacia de
conversión excepcional. Características técnicas MPPT Blue Solar 100V 50A VICTRON - Limitación de la
potencia fotovoltaica para batería de 12V: 700W (rango MPPT 15 y 70V) y para 24V: 1400W (rango MPPT
30 y 70V). - Tensión máxima del circuito abierto fotovoltaico: 100V. - Sin ventilador. Eficiencia
máxima del 98%. - Consumo propio de 10mA. - Temperatura de trabajo entre -30 y +60ºC. Corriente de
salida completa hasta los 40°C. Protección IP43 y conectores IP22 - Protección polaridad inversa de
baterías y de paneles FV (fusible no accesible). - Protección contra sobrecalentamiento, reducción
de potencia por exceso de temperatura. - Protección de cortocircuito en entrada de paneles FV. -
Compatible con VE.Direct para comunicaciones. - 1.25Kg de peso y dimensiones de 130x186x70mm. -
Existe una versión con Bluetooth integrado por unos 30€ adicionales con la que se puede monitorizar
y configurar desde el teléfono móvil todos los parámetros del regulador. Videos explicativos del
Regulador MPPT Blue Solar 100V 50A VICTRON Cómo usar el puerto VE Direct para configurar aparatos
Victron Como muestra el vídeo anterior, el Bluetooth VE Direct Victron Dongle es compatible con este
modelo de regulador. Para poderlo conectar únicamente deberá introducir la contraseña 000000 para
que se vincule y así poder configurar y monitorizar sus párametros como ejemplo que muestra la
imagen: Complementos opcionales compatibles con este Regulador Victron MPPT Display para Regulador
MPPT Victron. Este dispositivo que se vende aparte, sirve para poder monitorizar en un display toda
la información que maneja el regulador de carga. Se instala de un modo sencillo conectando un cable
VE.Direct (no incluído) entre el regulador y este display. Además dispone de 4 botones para poder
configurar parámetros internos de funcionamiento como los valores de carga y saber cifras de
producción. Ver producto. Ficha técnica del regulador MPPT Victron Ver ficha técnica del regulador
Victron MPPT Bluesolar 100V 50A Descargar manual regulador de carga MPPT Victron 100V 50A",https://cdn.autosolar.es/images/reguladores-carga/regulador-mppt-blue-solar-100v-50a-victron_thumb_main.jpg,,Reguladores
Regulador MPPT 100V 50A Victron Smart Solar,"429,32"," Regulador MPPT 100V 50A Victron Smart Solar Ver ficha técnica del regulador Victron MPPT Smart
Solar 100V 50A Ver manual del regulador Victron MPPT Smart Solar 100V 50A El Regulador MPPT 100V 50A
Victron Smart Solar es capaz de cargar una batería con una corriente de carga de hasta 50A y admite
una tensión en placas fotovoltaicas de hasta 100V. ¿Que es un regulador de carga? ¿y en qué se
diferencia un regulador MPPT? El Regulador MPPT 100V 50A Victron Smart Solar, es capaz de cargar una
batería desde paneles fotovoltaicos. Necesita una tensión en paneles solares superior a la tensión
nominal de batería para poder realizar este proceso. El Regulador MPPT 100V 50A Victron Smart Solar
ajusta automáticamente la tensión nominal de la batería a 12 o 24V, aunque gracias a su interfaz
bluetooth, podemos seleccionarlo nosotros manualmente, así como establecer parámetros de carga en
función de nuestras necesidades. Gracias al Regulador MPPT 100V 50A Victron Smart Solar podemos
utilizar paneles de 24V o de 60 células para cargar baterías de 12V sin ningún problema ni ninguna
pérdida de energía. El regulador aumentará la intensidad de carga reduciendo el voltaje para no
perder ni un solo vatio (W) de potencia Como es un regulador MPPT, cuando las condiciones
climatológicas son adversas, incluso con nubes o lluvia, la intensidad de la luz cambia
continuamente, con el Regulador MPPT 100V 50A Victron Smart Solar podremos adaptarnos a las nuevas
situaciones que se nos presenten en cada momento de una forma rápida y eficiente sacando el máximo
rendimiento del panel solar en cualquier situación. Detección avanzada del punto de máxima potencia
MPPT Smart Solar 100V 50A VICTRON Cuando la intensidad de la luz no es constante, el Regulador MPPT
100V 50A Victron Smart Solar mejora la recogida de energía en hasta un 30% respecto a un controlador
PWM e incluso un 10% respecto a otros MPPT. Incorpora un algoritmo para maximizar siempre la
recogida de energía alcanzando el punto de máxima potencia óptimo para dicho momento, gracias a ello
el Regulador MPPT 100V 50A Victron Smart Solar tiene una eficacia de conversión excepcional.
Características técnicas MPPT Smart Solar 100V 50A VICTRON - Limitación de la potencia fotovoltaica
para batería de 12V: 700W, para 24V: 1400W. - Tensión máxima del circuito abierto fotovoltaico:
100V. - Sin ventilador. Eficiencia máxima del 98%. - Consumo propio de 10mA. - Temperatura de
trabajo entre -30 y +60ºC. Corriente de salida completa hasta los 40°C. Protección IP43 y conectores
IP22 - Protección polaridad inversa de baterías (fusible no accesible) y de paneles FV. - Protección
contra cortocircuito en la salida. - Protección contra sobrecalentamiento, reducción de potencia por
exceso de temperatura. - Compatible con VE.Direct para comunicaciones. - 1,3Kg de peso y dimensiones
de 130x186x70mm. - Bluetooth integrado para configuración y monitorización con datos históricos y en
tiempo real. Videos explicativos del Regulador MPPT 100V 50A Victron Smart Solar Cómo usar el
bluetooth para configurar aparatos Victron Como muestra el vídeo anterior, para las versiones no
Smart se puede usar el Dongle Bluetooth con puerto VE Direct. Para todos los casos hay que tener en
cuenta que la contraseña de enlace del bluetooth es 000000 para poderlo vincular correctamente. En
este modelo, internamente el regulador dispone de bluetooth por lo que no necesitamos ningún
accesorio para configurar y monitorizar sus párametros como en los ejemplos que muestra la imagen:
Complementos opcionales compatibles con este Regulador Victron MPPT Display para Regulador MPPT
Victron SmartSolar. Este dispositivo que se vende aparte, sirve para poder monitorizar en un display
toda la información que maneja el regulador de carga. Se instala de un modo sencillo conectando un
cable VE.Direct (no incluído) entre el regulador y este display. Además dispone de 4 botones para
poder configurar parámetros internos de funcionamiento como los valores de carga y saber cifras de
producción. Ver producto. Ficha técnica del regulador MPPT Victron Ver ficha técnica del regulador
Victron MPPT Smart Solar 100V 50A Ver manual del regulador Victron MPPT Smart Solar 100V 50A",https://cdn.autosolar.es/images/reguladores-carga/regulador-mppt-100v-50a-victron-smart-solar_thumb_main.jpg,,Reguladores
Regulador MPPT 150V 35A Victron Smart Solar,"432,38"," Regulador MPPT 150V 35A Victron Smart Solar Ver ficha técnica del regulador Victron MPPT Smart
Solar 150V 35A Descargar Manual Regulador MPPT 150V 35A Victron Smart Solar El Regulador MPPT 150V
35A Victron Smart Solar es capaz de cargar una batería con una corriente de carga de hasta 35A y
admite una tensión en placas fotovoltaicas de hasta 150V. ¿Que es un regulador de carga? ¿y en qué
se diferencia un regulador MPPT? El Regulador MPPT 150V 35A Victron Smart Solar, es capaz de cargar
una batería desde paneles fotovoltaicos. Necesita una tensión en paneles solares superior a la
tensión nominal de batería para poder realizar este proceso. El Regulador MPPT 150V 35A Victron
Smart Solar ajusta automáticamente la tensión nominal de la batería a 12, 24V o 48V, aunque gracias
a su interfaz bluetooth, podemos seleccionarlo nosotros manualmente, así como establecer parámetros
de carga en función de nuestras necesidades. Gracias al Regulador MPPT 150V 35A Victron Smart Solar
podemos utilizar paneles de 24V o de 60 células para cargar baterías de 12V sin ningún problema ni
ninguna pérdida de energía. El regulador aumentará la intensidad de carga reduciendo el voltaje para
no perder ni un solo vatio (W) de potencia Como es un regulador MPPT, cuando las condiciones
climatológicas son adversas, incluso con nubes o lluvia, la intensidad de la luz cambia
continuamente, con el Regulador MPPT 150V 35A Victron Smart Solar podremos adaptarnos a las nuevas
situaciones que se nos presenten en cada momento de una forma rápida y eficiente sacando el máximo
rendimiento del panel solar en cualquier situación. Detección avanzada del punto de máxima potencia
MPPT Smart Solar 150V 35A VICTRON Cuando la intensidad de la luz no es constante, el Regulador MPPT
150V 35A Victron Smart Solar mejora la recogida de energía en hasta un 30% respecto a un controlador
PWM e incluso un 10% respecto a otros MPPT. Incorpora un algoritmo para maximizar siempre la
recogida de energía alcanzando el punto de máxima potencia óptimo para dicho momento, gracias a ello
el Regulador MPPT 150V 35A Victron Smart Solar tiene una eficacia de conversión excepcional.
Características técnicas MPPT Smart Solar 150V 35A VICTRON - Limitación de la potencia fotovoltaica
para batería de 12V: 500W, para 24V: 1000W y a 48V: 2000W. - Tensión máxima del circuito abierto
fotovoltaico: 150V en frío, 145V funcionando al máximo. - Sin ventilador. Eficiencia máxima del 98%.
- Consumo propio de 10mA. - Temperatura de trabajo entre -30 y +60ºC. Corriente de salida completa
hasta los 40°C. Protección IP43 y conectores IP22 - Protección polaridad inversa de baterías
(fusible no accesible) y de paneles FV. - Protección contra cortocircuito en la salida. - Protección
contra sobrecalentamiento, reducción de potencia por exceso de temperatura. - Compatible con
VE.Direct para comunicaciones. - 1,25Kg de peso y dimensiones de 130x186x70mm. - Bluetooth integrado
para configuración y monitorización con datos históricos y en tiempo real. Videos explicativos del
Regulador MPPT 150V 35A Victron Smart Solar Cómo usar el bluetooth para configurar aparatos Victron
Como muestra el vídeo anterior, para las versiones no Smart se puede usar el Dongle Bluetooth con
puerto VE Direct. Para todos los casos hay que tener en cuenta que la contraseña de enlace del
bluetooth es 000000 para poderlo vincular correctamente. En este modelo, internamente el regulador
dispone de bluetooth por lo que no necesitamos ningún accesorio para configurar y monitorizar sus
párametros como en los ejemplos que muestra la imagen: Complementos opcionales compatibles con este
Regulador Victron MPPT Display para Regulador MPPT Victron SmartSolar. Este dispositivo que se vende
aparte, sirve para poder monitorizar en un display toda la información que maneja el regulador de
carga. Se instala de un modo sencillo conectando un cable VE.Direct (no incluído) entre el regulador
y este display. Además dispone de 4 botones para poder configurar parámetros internos de
funcionamiento como los valores de carga y saber cifras de producción. Ver producto. Ficha técnica
del regulador MPPT Victron Ver ficha técnica del regulador Victron MPPT Smart Solar 150V 35A
Descargar Manual Regulador MPPT 150V 35A Victron Smart Solar",https://cdn.autosolar.es/images/reguladores-carga/regulador-mppt-150v-35a-victron-smart-solar_thumb_main.jpg,,Reguladores
Regulador MPPT 150V 45A Victron Smart Solar,"491,03"," Regulador MPPT 150V 45A Victron Smart Solar Ficha técnica Regulador MPPT 150V 45A Victron Smart
Solar Ficha técnica Regulador MPPT 150V 45A Victron Smart Solar Descargar Manual Regulador MPPT 150V
45A Victron Smart Solar Características Regulador MPPT 150V 45A Victron Smart Solar El Regulador
MPPT 150V 45A Victron Smart Solar, se caracteriza por: - Seguimiento ultrarrápido del Punto de
Máxima Potencia (MPPT). - Detección avanzada del Punto de Máxima Potencia en caso de nubosidad
parcial. - Excepcional eficiencia de conversión - Algoritmo de carga flexible Un algoritmo de carga
totalmente programable. - Amplia protección electrónica. - Sensor de temperatura interna. -
Bluetooth Smart integrado. - VE.Direct. - On/Off remoto. - Relé programable. - Opcional: pantalla
LCD conectable Aspectos relevantes Regulador MPPT 150V 45A Victron Smart Solar El Regulador MPPT
150V 45A Victron Smart Solar es compatible con el Color Control GX, es decir, se ofrece un control y
monitorización intuitivos de todos los productos conectados a él, es más, el Regulador MPPT 150V 45A
Victron Smart Solar además de monitorizar y controlar productos en el Color Control GX, la
información también para la monitorización remota sin ningún tipo de coste. El Regulador MPPT 150V
45A Smart Solar cuando está conectado a baterías de 12V admite una potencia máxima de 650W por lo
que energía fotovoltaica producida de más no será almacenada. Cuando las bateterías conectadas sean
de 24V, la potencia máxima que podrá gestionar el regulador será de 1300W. En caso de que se
conecten baterías de 36V el regulador podrá gestionar hasta 1950W,y cuando el regulador se conecte a
baterías de 48V será capaz de trabajar hasta una potencia de paneles de 2600W. Cabe destacar que
estas medidas no determinan un máximo que cuando se supera el regulador MPPT deja de funcionar, si
no que se trata de la potencia máxima que cuando los paneles solare superan en su producción se
pierde, de ahí la importancia de la consonancia entre el número de paneles fotovoltaicos, el
regulador de carga instalado y las baterías conectadas. El Regulador MPPT 150V 45A Victron Smart
Solar cuenta como medida de protección con polaridad inversa de la batería (fusible, no accesible
por el usuario) y polaridad inversa/Cortocircuito de salida/Sobretemperatura. Ficha técnica
Regulador MPPT 150V 45A Victron Smart Solar Ficha técnica Regulador MPPT 150V 45A Victron Smart
Solar Descargar Manual Regulador MPPT 150V 45A Victron Smart Solar",https://cdn.autosolar.es/images/reguladores-carga/regulador-mppt-150v-45a-victron-smart-solar_thumb_main.jpg,,Reguladores
Regulador MPPT Blue Solar 150V 45A VICTRON,"492,37"," Regulador MPPT Blue Solar 150V 45A VICTRON Ver ficha técnica del regulador Victron MPPT Bluesolar
150V 45A Descargar manual regulador de carga MPPT Victron 150V 45A El Regulador MPPT Blue Solar 150V
45A VICTRON es capaz de alcanzar una corriente de carga de hasta 45Ay una tensión de placas
fotovoltaicas de hasta 150V. ¿Que es un regulador de carga? ¿y en qué se diferencia un regulador
MPPT? El Regulador MPPT Blue Solar 150V 45A VICTRON, es capaz de cargar una batería con una tensión
nominal inferior a partir de las placas fotovoltaicas que tengan una tensión nominal superior. El
Regulador MPPT Blue Solar 150V 45A VICTRON ajusta automáticamente la tensión nominal de la batería a
12, 24, 36 ó 48V es decir, que no debemos preocuparnos si tenemos una instalación solar con baterías
a 12, 24, 36 ó 48V, ya que el Regulador MPPT Blue Solar 150V 45A VICTRON será capaz de detectarlo
automáticamente. Para la opción de 36V se necesita de una herramienta software adicional. Cuando las
condiciones climatológicas son adversas, con nubes o lluvia, la intensidad de la luz cambia
continuamente, con el Regulador MPPT Blue Solar 150V 45A VICTRON podremos adaptarnos a las nuevas
situaciones que se nos presenten en cada momento de una forma rápida y eficiente. Detección avanzada
del punto de máxima potencia MPPT Blue Solar 150V 45A VICTRON Cuando la intensidad de la luz no es
constante, el Regulador MPPT Blue Solar 150V 45A VICTRON mejora la recogida de energía en hasta un
30% respecto a un controlador PWM e incluso un 10% respecto a otros MPPT. Incorpora un algoritmo
para maximizar siempre la recogida de energía alcanzando el punto de máxima potencia óptimo para
dicho momento. El Regulador MPPT Blue Solar 150V 45A VICTRON tiene una eficacia de conversión
excepcional. Características técnicas MPPT Blue Solar 150V 45A VICTRON - Limitación de la potencia
fotovoltaica para batería de 12V: 650W, para 24V: 1300W y para 48V: 2600W. - Tensión máxima del
circuito abierto fotovoltaico: 150V en frío, 145V en arranque y funcionando al máximo. - Sin
ventilador. Eficiencia máxima del 98%. - Consumo propio de 10mA. - Temperatura de trabajo entre -30
y +60ºC. Corriente de salida completa hasta los 40°C. Protección IP43 y conectores IP22 - Protección
polaridad inversa de baterías y de paneles FV (fusible no accesible). - Protección contra
sobrecalentamiento, reducción de potencia por exceso de temperatura. - Protección de cortocircuito
en entrada de paneles FV. - Compatible con VE.Direct para comunicaciones. - 3Kg de peso y
dimensiones de 185x250x95mm. Videos explicativos del Regulador MPPT Blue Solar 150V 45A VICTRON Cómo
usar el puerto VE Direct para configurar aparatos Victron Como muestra el vídeo anterior, el
Bluetooth VE Direct Victron Dongle es compatible con este modelo de regulador. Para poderlo conectar
únicamente deberá introducir la contraseña 000000 para que se vincule y así poder configurar y
monitorizar sus párametros como ejemplo que muestra la imagen: Complementos opcionales compatibles
con este Regulador Victron MPPT Display para Regulador MPPT Victron. Este dispositivo que se vende
aparte, sirve para poder monitorizar en un display toda la información que maneja el regulador de
carga. Se instala de un modo sencillo conectando un cable VE.Direct (no incluído) entre el regulador
y este display. Además dispone de 4 botones para poder configurar parámetros internos de
funcionamiento como los valores de carga y saber cifras de producción. Ver producto. Ficha técnica
del regulador MPPT Victron Ver ficha técnica del regulador Victron MPPT Bluesolar 150V 45A Descargar
manual regulador de carga MPPT Victron 150V 45A",https://cdn.autosolar.es/images/reguladores-carga/regulador-mppt-blue-solar-150v-45a-victron_thumb_main.jpg,,Reguladores
