title,cost,description,img_src,photo_desc_str,category
Regulador 12V / 24V 10A PWM Must Solar,"22,51"," Ficha técnica Regulador 12V / 24V 10A PWM Must Solar Ver la Ficha Técnica del Regulador 12V / 24V
10A PWM Must Solar Ver Manual del Regulador 12V / 24V 10A PWM Must Solar Características técnicas
Regulador 12V / 24V 10A PWM Must Solar Este Regulador PWM del fabricante Must Solar cuenta con
identificación automática del nivel de voltaje del sistema, modo de carga inteligente PWM y
protección de carga y descarga ajustable. Además, el Regulador 12V / 24V 10A PWM Must Solar cuenta
con varios algoritmos de carga en función de la tecnología de nuestra batería, así como protección
de descarga inversa de la batería. Otra de las características más atractivas del Regulador 12V /
24V 10A PWM Must Solar cuenta con protección contra la sobretensión y 2 salidas USB con 1A de
potencia de carga. Este regulador PWM soporta, en función de la tensión de trabajo, la siguiente
potencia máxima: - 12V: Panel de 130W. - 24V: Panel de 260W. Pantalla del Regulador 12V / 24V 10A
PWM Must Solar Los Reguladores PWM Must incorporan una pantalla LCD desde la que podremos visualizar
los siguientes parámetros: - Estado general de funcionamiento. - Voltaje de batería y estimacion del
SOC (barra de carga). - Intensidad entrante en A desde paneles. - Intensidad saliente en A hacia
consumo en corriente continua. - Algoritmo de carga seleccionado en función de la tecnología de
nuestra batería. - Acumulado de intensidad entrante fotovoltaica y saliente en consumo reseteable. -
Temperatura mediante el sensor integrado Esquema de Conexión Regulador 12V / 24V 10A PWM Must Solar
Instalación Regulador 12V / 24V 10A PWM Must Solar La instalación de este modelo de regulador es muy
sencilla, no obstante desde AutoSolar se recomienda que el Regulador 12V / 24V 10A PWM Must Solar
sea instalado por un profesional del sector, o bien se sigan estrictamente las instrucciones de
instalación para evitar roturas y averías por culpa de una instalación incorrecta. En AutoSolar
además de ofrecerle el Regulador 12V / 24V 10A PWM Must Solar al mejor precio con garantía de
funcionamiento también ponemos a su disposición el servicio de instalación y puesta a punto del
Regulador 12V / 24V 10A PWM Must Solar por parte del equipo de instaladores profesionales de
AutoSolar. No obstante para un producto de estas características puede instalarlo usted mismo, ya
que en la puesta en marcha nos puede consultar y le podremos asistir para que lo pueda instalar
usted mismo La instalación y puesta a punto con garantía de funcionamiento está disponible para el
Regulador 12V / 24V 10A PWM Must Solar y para todos los productos de la página web, contáctenos para
más información. Puede consultar algunas de nuestras instalaciones realizadas aquí. Bornera de
Conexiones del Regulador 12V / 24V 10A PWM Must Solar Instalación fotovoltaica con Regulador 12V /
24V 10A PWM Must Solar En AutoSolar somos conscientes de que en muchas ocasiones se desea comprar un
Regulador 12V / 24V 10A PWM Must Solar para realizar una instalación fotovoltaica, de ahí que
pongamos a su disposición los kits solares en los que nuestros técnicos profesionales le pueden
personalizar cualquiera de los kits con el objetivo de que el kit fotovoltaico se adecue
perfectamente a sus necesidades. Si desea personalizar cualquiera de los kits solares para
incorporar o cambiar su inversor cargador por el Regulador 12V / 24V 10A PWM Must Solar contáctenos
y sin compromiso le enviaremos el presupuesto personalizado. En AutoSolar le personalizamos
cualquiera de nuestros kits con los componentes que mejor se adecuen a sus necesidades, contáctenos.
Asesoramiento gratuito Regulador 12V / 24V 10A PWM Must Solar En AutoSolar le asesoramos de forma
gratuita y sin compromiso sobre el Regulador 12V / 24V 10A PWM Must Solar para asegurarle que le va
a cubrir sus necesidades.El servicio de asesoramiento y estudio personalizado es gratuito tanto para
el Regulador 12V / 24V 10A PWM Must Solar como para el resto de productos y kits solares de nuestra
web, consúltenos sin compromiso. Puede consultar información técnica y de instalación de muchos de
nuestros productos en nuestro canal de Youtube. Precio Regulador 12V / 24V 10A PWM Must Solar El
precio del Regulador 12V / 24V 10A PWM Must Solar de AutoSolar incluye garantía de fabricante,
respaldo técnico durante su vida útil y asesoramiento gratuito. El precio del Regulador 12V / 24V
10A PWM Must Solar más competitivo del mercado únicamente lo podrá encontrar en AutoSolar. Regulador
12V / 24V 10A PWM Must Solar al mejor precio El Regulador 12V / 24V 10A PWM Must Solar al mejor
precio cuenta con garantía de fabricante, servicio de atención personalizada profesional y las
mejores funciones dentro de su categoría. Confíe únicamente en aquellas empresas que le ofrecen
todas las garantías y trabajan con los mejores fabricantes internacionales. En AutoSolar el
Regulador 12V / 24V 10A PWM Must Solar y todos los productos siempre al mejor precio disfrutan de un
amplio periodo de garantía cumpliendo con la normativa vigente, asesoramiento gratuito e instalación
donde usted requiera. Comprar Regulador 12V / 24V 10A PWM Must Solar barato Comprar Regulador 12V /
24V 10A PWM Must Solar barato es rápido, seguro y cómodo gracias a AutoSolar, además el Regulador
12V / 24V 10A PWM Must Solar barato cuenta con garantía oficial y si lo desea el equipo de
instaladores profesionales puede realizarle la instalación y puesta en marcha con garantía de
funcionamiento donde usted requiera. Financiar compra Regulador 12V / 24V 10A PWM Must Solar
AutoSolar de la mano de Cetelem pone a su disposición el servicio de financiación del Regulador 12V
/ 24V 10A PWM Must Solar y de cualquiera de los productos y kits solares de la página web siempre
que superen el importe mínimo exigido. Para Financiar compra Regulador 12V / 24V 10A PWM Must Solar
junto con las modalidades de pago que le aparecen al realizar el pago por el carrito tendrá la
opción de financiar la compra del Regulador 12V / 24V 10A PWM Must Solar o de los productos que haya
seleccionado por la web. Siga los pasos que le determina Cetelem, cuando envíe la documentación
requerida se le comunicará que la misma ha sido correcta y se formalizará su financiación. Ficha
técnica Regulador 12V / 24V 10A PWM Must Solar Ver la Ficha Técnica del Regulador 12V / 24V 10A PWM
Must Solar",https://cdn.autosolar.es/images/reguladores-carga/regulador-12v-24v-10a-pwm-must-solar_thumb_main.jpg,,Reguladores
Regulador 12V / 24V 20A PWM Must Solar,"27,78"," Ficha técnica Regulador 12V / 24V 20A PWM Must Solar Ver la Ficha Técnica del Regulador 12V / 24V
20A PWM Must Solar Ver Manual del Regulador 12V / 24V 20A PWM Must Solar Características técnicas
Regulador 12V / 24V 20A PWM Must Solar Este Regulador PWM del fabricante Must Solar cuenta con
identificación automática del nivel de voltaje del sistema, modo de carga inteligente PWM y
protección de carga y descarga ajustable. Además, el Regulador 12V / 24V 20A PWM Must Solar cuenta
con varios algoritmos de carga en función de la tecnología de nuestra batería, así como protección
de descarga inversa de la batería. Otra de las características más atractivas del Regulador 12V /
24V 20A PWM Must Solar cuenta con protección contra la sobretensión y 2 salidas USB con 1A de
potencia de carga. Este regulador PWM soporta, en función de la tensión de trabajo, la siguiente
potencia máxima: - 12V: Hasta 260W en paneles de 12V. - 24V: Hasta 520W en paneles de 24V. Pantalla
del Regulador 12V / 24V 20A PWM Must Solar Los Reguladores PWM Must incorporan una pantalla LCD
desde la que podremos visualizar los siguientes parámetros: - Estado general de funcionamiento. -
Voltaje de batería y estimacion del SOC (porcentaje de carga). - Intensidad entrante en A desde
paneles. - Intensidad saliente en A hacia consumo en corriente continua. - Algoritmo de carga
seleccionado en función de la tecnología de nuestra batería. - Acumulado de intensidad entrante
fotovoltaica y saliente en consumo reseteable. - Temperatura mediante el sensor integrado Esquema de
Conexión Regulador 12V / 24V 20A PWM Must Solar Instalación Regulador 12V / 24V 20A PWM Must Solar
La instalación de este modelo de regulador es muy sencilla, no obstante desde AutoSolar se
recomienda que el Regulador 12V / 24V 20A PWM Must Solar sea instalado por un profesional del
sector, o bien se sigan estrictamente las instrucciones de instalación para evitar roturas y averías
por culpa de una instalación incorrecta. En AutoSolar además de ofrecerle el Regulador 12V / 24V 20A
PWM Must Solar al mejor precio con garantía de funcionamiento también ponemos a su disposición el
servicio de instalación y puesta a punto del Regulador 12V / 24V 20A PWM Must Solar por parte del
equipo de instaladores profesionales de AutoSolar. No obstante para un producto de estas
características puede instalarlo usted mismo, ya que en la puesta en marcha nos puede consultar y le
podremos asistir para que lo pueda instalar usted mismo La instalación y puesta a punto con garantía
de funcionamiento está disponible para el Regulador 12V / 24V 20A PWM Must Solar y para todos los
productos de la página web, contáctenos para más información. Puede consultar algunas de nuestras
instalaciones realizadas aquí. Bornera de Conexiones del Regulador 12V / 24V 20A PWM Must Solar
Instalación fotovoltaica con Regulador 12V / 24V 20A PWM Must Solar En AutoSolar somos conscientes
de que en muchas ocasiones se desea comprar un Regulador 12V / 24V 20A PWM Must Solar para realizar
una instalación fotovoltaica, de ahí que pongamos a su disposición los kits solares en los que
nuestros técnicos profesionales le pueden personalizar cualquiera de los kits con el objetivo de que
el kit fotovoltaico se adecue perfectamente a sus necesidades. Si desea personalizar cualquiera de
los kits solares para incorporar o cambiar su inversor cargador por el Regulador 12V / 24V 20A PWM
Must Solar contáctenos y sin compromiso le enviaremos el presupuesto personalizado. En AutoSolar le
personalizamos cualquiera de nuestros kits con los componentes que mejor se adecuen a sus
necesidades, contáctenos. Asesoramiento gratuito Regulador 12V / 24V 20A PWM Must Solar En AutoSolar
le asesoramos de forma gratuita y sin compromiso sobre el Regulador 12V / 24V 20A PWM Must Solar
para asegurarle que le va a cubrir sus necesidades. El servicio de asesoramiento y estudio
personalizado es gratuito tanto para el Regulador 12V / 24V 20A PWM Must Solar como para el resto de
productos y kits solares de nuestra web, consúltenos sin compromiso. Puede consultar información
técnica y de instalación de muchos de nuestros productos en nuestro canal de Youtube. Precio
Regulador 12V / 24V 20A PWM Must Solar El precio del Regulador 12V / 24V 20A PWM Must Solar de
AutoSolar incluye garantía de fabricante, respaldo técnico durante su vida útil y asesoramiento
gratuito. El precio del Regulador 12V / 24V 20A PWM Must Solar más competitivo del mercado
únicamente lo podrá encontrar en AutoSolar. Regulador 12V / 24V 20A PWM Must Solar al mejor precio
El Regulador 12V / 24V 20A PWM Must Solar al mejor precio cuenta con garantía de fabricante,
servicio de atención personalizada profesional y garantía de fabricante. Confíe únicamente en
aquellas empresas que le ofrecen todas las garantías y trabajan con los mejores fabricantes
internacionales. En AutoSolar el Regulador 12V / 24V 20A PWM Must Solar y todos los productos
siempre al mejor precio disfrutan de un amplio periodo de garantía cumpliendo con la normativa
vigente, asesoramiento gratuito e instalación donde usted requiera. Comprar Regulador 12V / 24V 20A
PWM Must Solar barato Comprar Regulador 12V / 24V 20A PWM Must Solar barato es rápido, seguro y
cómodo gracias a AutoSolar, además el Regulador 12V / 24V 20A PWM Must Solar barato cuenta con
garantía oficial y si lo desea el equipo de instaladores profesionales puede realizarle la
instalación y puesta en marcha con garantía de funcionamiento donde usted requiera. Financiar compra
Regulador 12V / 24V 20A PWM Must Solar AutoSolar de la mano de Cetelem pone a su disposición el
servicio de financiación del Regulador 12V / 24V 20A PWM Must Solar y de cualquiera de los productos
y kits solares de la página web siempre que superen el importe mínimo exigido. Para Financiar compra
Regulador 12V / 24V 20A PWM Must Solar junto con las modalidades de pago que le aparecen al realizar
el pago por el carrito tendrá la opción de financiar la compra del Regulador 12V / 24V 20A PWM Must
Solar o de los productos que haya seleccionado por la web. Siga los pasos que le determina Cetelem,
cuando envíe la documentación requerida se le comunicará que la misma ha sido correcta y se
formalizará su financiación. Videos explicativos del Regulador 12V / 24V 20A PWM Must Solar
Reguladores de Carga MPPT Must Solar. Modelos y características Mantenimiento de baterías solares
Ficha técnica Regulador 12V / 24V 20A PWM Must Solar Ver la Ficha Técnica del Regulador 12V / 24V
20A PWM Must Solar AutoSolar queda a su disposición para asesorarle sobre el Regulador 12V / 24V 20A
PWM Must Solar o cualquiera de los productos de nuestra página web, contáctenos para más
información.",https://cdn.autosolar.es/images/reguladores-carga/regulador-12v-24v-20a-pwm-must-solar_thumb_main.jpg,,Reguladores
Regulador 12V / 24V 30A PWM Must Solar,"35,39"," Ficha técnica Regulador 12V / 24V 30A PWM Must Solar Ver la Ficha Técnica del Regulador 12V / 24V
30A PWM Must Solar Ver Manual del Regulador 12V / 24V 30A PWM Must Solar Características técnicas
Regulador 12V / 24V 30A PWM Must Solar Este Regulador PWM del fabricante Must Solar cuenta con
identificación automática del nivel de voltaje del sistema, modo de carga inteligente PWM y
protección de carga y descarga ajustable. Además, el Regulador 12V / 24V 30A PWM Must Solar cuenta
con varios algoritmos de carga en función de la tecnología de nuestra batería, así como protección
de descarga inversa de la batería. Otra de las características más atractivas del Regulador 12V /
24V 30A PWM Must Solar cuenta con protección contra la sobretensión y 2 salidas USB con 1A de
potencia de carga. Este regulador PWM soporta, en función de la tensión de trabajo, la siguiente
potencia máxima: - 12V: Hasta 390W en paneles de 12V. - 24V: Hasta 780W en paneles de 24V Pantalla
del Regulador 12V / 24V 30A PWM Must Solar Los Reguladores PWM Must incorporan una pantalla LCD
desde la que podremos visualizar los siguientes parámetros: - Estado general de funcionamiento. -
Voltaje de batería y estimacion del SOC (porcentaje de carga). - Intensidad entrante en A desde
paneles. - Intensidad saliente en A hacia consumo en corriente continua. - Algoritmo de carga
seleccionado en función de la tecnología de nuestra batería. - Acumulado de intensidad entrante
fotovoltaica y saliente en consumo reseteable. - Temperatura mediante el sensor integrado Esquema de
Conexión Regulador 12V / 24V 30A PWM Must Solar Instalación Regulador 12V / 24V 30A PWM Must Solar
La instalación de este modelo de regulador es muy sencilla, no obstante desde AutoSolar se
recomienda que el Regulador 12V / 24V 30A PWM Must Solar sea instalado por un profesional del
sector, o bien se sigan estrictamente las instrucciones de instalación para evitar roturas y averías
por culpa de una instalación incorrecta. En AutoSolar además de ofrecerle el Regulador 12V / 24V 30A
PWM Must Solar al mejor precio con garantía de funcionamiento también ponemos a su disposición el
servicio de instalación y puesta a punto del Regulador 12V / 24V 30A PWM Must Solar por parte del
equipo de instaladores profesionales de AutoSolar. No obstante para un producto de estas
características puede instalarlo usted mismo, ya que en la puesta en marcha nos puede consultar y le
podremos asistir para que lo pueda instalar usted mismo La instalación y puesta a punto con garantía
de funcionamiento está disponible para el Regulador 12V / 24V 30A PWM Must Solar y para todos los
productos de la página web, contáctenos para más información. Puede consultar algunas de nuestras
instalaciones realizadas aquí. Bornera de Conexiones del Regulador 12V / 24V 30A PWM Must Solar
Instalación fotovoltaica con Regulador 12V / 24V 30A PWM Must Solar En AutoSolar somos conscientes
de que en muchas ocasiones se desea comprar un Regulador 12V / 24V 30A PWM Must Solar para realizar
una instalación fotovoltaica, de ahí que pongamos a su disposición los kits solares en los que
nuestros técnicos profesionales le pueden personalizar cualquiera de los kits con el objetivo de que
el kit fotovoltaico se adecue perfectamente a sus necesidades. Si desea personalizar cualquiera de
los kits solares para incorporar o cambiar su inversor cargador por el Regulador 12V / 24V 30A PWM
Must Solar contáctenos y sin compromiso le enviaremos el presupuesto personalizado. En AutoSolar le
personalizamos cualquiera de nuestros kits con los componentes que mejor se adecuen a sus
necesidades, contáctenos. Asesoramiento gratuito Regulador 12V / 24V 30A PWM Must Solar En AutoSolar
le asesoramos de forma gratuita y sin compromiso sobre el Regulador 12V / 24V 30A PWM Must Solar
para asegurarle que le va a cubrir sus necesidades. El servicio de asesoramiento y estudio
personalizado es gratuito tanto para el Regulador 12V / 24V 30A PWM Must Solar como para el resto de
productos y kits solares de nuestra web, consúltenos sin compromiso. Puede consultar información
técnica y de instalación de muchos de nuestros productos en nuestro canal de Youtube. Precio
Regulador 12V / 24V 30A PWM Must Solar El precio del Regulador 12V / 24V 30A PWM Must Solar de
AutoSolar incluye garantía de fabricante, respaldo técnico durante su vida útil y asesoramiento
gratuito. El precio del Regulador 12V / 24V 30A PWM Must Solar más competitivo del mercado
únicamente lo podrá encontrar en AutoSolar. Regulador 12V / 24V 30A PWM Must Solar al mejor precio
El Regulador 12V / 24V 30A PWM Must Solar al mejor precio cuenta con garantía de fabricante,
servicio de atención personalizada profesional y garantía de fabricante. Confíe únicamente en
aquellas empresas que le ofrecen todas las garantías y trabajan con los mejores fabricantes
internacionales. En AutoSolar el Regulador 12V / 24V 30A PWM Must Solar y todos los productos
siempre al mejor precio disfrutan de un amplio periodo de garantía cumpliendo con la normativa
vigente, asesoramiento gratuito e instalación donde usted requiera. Comprar Regulador 12V / 24V 30A
PWM Must Solar barato Comprar Regulador 12V / 24V 30A PWM Must Solar barato es rápido, seguro y
cómodo gracias a AutoSolar, además el Regulador 12V / 24V 30A PWM Must Solar barato cuenta con
garantía oficial y si lo desea el equipo de instaladores profesionales puede realizarle la
instalación y puesta en marcha con garantía de funcionamiento donde usted requiera. Financiar compra
Regulador 12V / 24V 30A PWM Must Solar AutoSolar de la mano de Cetelem pone a su disposición el
servicio de financiación del Regulador 12V / 24V 30A PWM Must Solar y de cualquiera de los productos
y kits solares de la página web siempre que superen el importe mínimo exigido. Para Financiar compra
Regulador 12V / 24V 30A PWM Must Solar junto con las modalidades de pago que le aparecen al realizar
el pago por el carrito tendrá la opción de financiar la compra del Regulador 12V / 24V 30A PWM Must
Solar o de los productos que haya seleccionado por la web. Siga los pasos que le determina Cetelem,
cuando envíe la documentación requerida se le comunicará que la misma ha sido correcta y se
formalizará su financiación. Ficha técnica Regulador 12V / 24V 30A PWM Must Solar Ver la Ficha
Técnica del Regulador 12V / 24V 30A PWM Must Solar AutoSolar queda a su disposición para asesorarle
sobre el Regulador 12V / 24V 30A PWM Must Solar o cualquiera de los productos de nuestra página web,
contáctenos para más información.",https://cdn.autosolar.es/images/reguladores-carga/regulador-12v-24v-30a-pwm-must-solar_thumb_main.jpg,,Reguladores
