title,cost,description,img_src,photo_desc_str,category
Regulador 48V 40A PWM Must Solar,"85,75"," Regulador 48V 40A PWM Must Solar Ficha técnica del Regulador 48V 40A PWM Must Solar Ficha técnica
del Regulador 48V 40A PWM Must Solar Manual del Regulador 48V 50A PWM Must Solar Características
técnicas del Regulador 48V 40A PWM Must Solar El Regulador 48V 50A PWM de Must Solar es un
dispositivo de alta calidad que se utiliza en sistemas de energía solar fotovoltaicos para controlar
y optimizar el flujo de energía entre los paneles solares, la batería y el dispositivo de carga.
Este regulador cuenta con una serie de características y funcionalidades que lo hacen ideal para su
uso en sistemas de energía solar. Por ejemplo, cuenta con identificación automática del nivel de
voltaje del sistema, lo que permite una operación más eficiente. También cuenta con un modo de carga
inteligente PWM y una protección de carga y descarga ajustable, lo que garantiza una carga segura y
eficiente de la batería. Además, este regulador cuenta con diversos algoritmos de carga en función
de la tecnología de la batería y protección contra la sobretensión, lo que aumenta su durabilidad y
confiabilidad. El Regulador PWM de Must Solar cuenta con una pantalla LCD desde la que se pueden
visualizar diferentes parámetros que nos permiten: Conocer el estado y el rendimiento del sistema de
energía solar. Visualizar el voltaje de la batería y la intensidad entrante y saliente en el
sistema. También se puede ver el algoritmo de carga seleccionado en función de la tecnología de la
batería y El acumulado de intensidad entrante y saliente en el sistema. La pantalla también muestra
la temperatura medida por el sensor integrado en el regulador. Esta información es muy útil para
monitorear y optimizar el rendimiento del sistema de energía solar. Instalación del Regulador 48V
40A PWM Must Solar Desde AutoSolar se recomienda que el Regulador 48V 40A PWM Must Solar sea
instalado por un profesional del sector, o bien se sigan estrictamente las instrucciones de
instalación para evitar roturas y averías por culpa de una instalación incorrecta. Podemos ofrecerle
nuestro servicio de instalación y puesta a punto por parte de nuestro equipo de instaladores
profesionales de AutoSolar. Si desea, también puedes instalar el producto tu mismo, ya que estamos
dispuestos a asistirte en la puesta en marcha y resolver cualquier duda que tengas durante el
proceso. De esta manera, podrás aprovechar al máximo tu producto y disfrutar de sus beneficios.
Esquema de Conexión Regulador 48V 50A PWM Must Solar Ficha técnica del Regulador 48V 40A PWM Must
Solar Ficha técnica del Regulador 48V 40A PWM Must Solar Manual del Regulador 48V 50A PWM Must Solar",https://cdn.autosolar.es/images/reguladores-carga/regulador-48v-40a-pwm-must-solar_thumb_main.jpg,,Reguladores
Regulador PWM BlueSolar 48V 10A LCD USB Victron,"86,14"," Regulador PWM BlueSolar 48V 10A LCD USB Victron Ficha Técnica Regulador PWM BlueSolar 48V 10A LCD
USB Victron Ficha Técnica Regulador PWM BlueSolar 48V 10A Victron Manual Regulador PWM BlueSolar 48V
10A Victron Descripción del Regulador PWM BlueSolar 48V 10A LCD USB Victron La gama de reguladores
PWM BlueSolar LCD USB Victron se compone por reguladores de carga de entre 5A y 30A para sistemas de
12 y 24V y tres reguladores de carga también PWM que trabajan a 48V y de hasta 30A. Estos
reguladores cuenta varias características propias pero las particularidades destacables son que
cuentan con pantalla integrada y son compatibles también con baterías de litio, además el regulador
PWM BlueSolar 48V 10A Victron cuenta con dos salidas USB de 5 voltios con una corriente máxima de
ambas salidas en conjunto de 2A. Como se ha especificado anteriormente el regulador PWM BlueSolar
48V 10A LCD USB Victron incorpora una pantalla de cristal líquido para realizar el seguimiento y
configuración del dispositivo así como una salida de carga para evitar que la batería se descargue e
exceso conectando toda las cargas a la salida de carga. Esta salida desconectará la carga cuando la
batería se haya descargado hasta alcanzar una tensión preestablecida. Algunas cargas, sobre todo las
cargas de los inversores es mejor conectarlas directamente a la batería, y el control remoto del
inversor a la salida de carga. Puede que se necesite un cable de interfaz especial, para este caso
consulte el manual donde se detallan estos detalles. La tensión de conexión y desconexión son
ajustables. El regulador PWM BlueSolar 48V 10A Victron cuenta con programación de día y noche de la
salida de carga, esta opción permite preajustar el ON-time después del crepúsculo optimizando el
funcionamiento del sistema. El algoritmo de carga de la batería es programable, tal y como se ha
dicho anteriormente, para baterías AGM, GEL, baterías de plomo ácido abierto y batería de litio. La
compatibilidad de reguladores de carga con batería de litio que integran pantalla LCD es una valor
añadido para este fabricante que está desarrollando recientemente con el objetivo de llegar al
público más variado. Instalación y Arranque Regulador PWM BlueSolar 48V 10A Victron Se recomienda
que el regulador PWM BlueSolar 48V 10A Victron sea instalado por un profesional o alguien con
conocimientos básicos al respecto, pues aunque la configuración es sencilla se deben seguir las
indicaciones y programar los parámetros de forma que el regulador PWM BlueSolar 48V 10A Victron sea
compatible con el resto de elementos del sistema fotovoltaico. Es conveniente que la instalación del
regulador PWM BlueSolar 48V 10A Victron se realice sobre una superficie plana horizontal ubicada en
el interior o un lugar protegido de altas temperaturas, luz solar directa o humedad que pudiera
inferir en su correcto funcionamiento. Puede consultar el manual de instalación junto con la
descripción de este producto, si tiene alguna duda contáctenos y nuestro equipo técnico le asesorará
al respecto. Si compra el regulador PWM BlueSolar 48V 10A Victron junto con el resto de elementos
para conseguir el autoconsumo en su vivienda nuestro departamento de instaladores puede realizarle
la instalación y puesta a punto con garantía de funcionamiento tanto del regulador PWM BlueSolar 48V
10A Victron como del resto de elementos del kit solar, Puede consultar algunas de nuestras
instalaciones realizadas aquí. Comprar Regulador PWM BlueSolar 48V 10A Victron Comprar regulador PWM
BlueSolar 48V 10A Victron al mejor precio es fácil, rápido y seguro con AutoSolar, contáctenos sin
compromiso para asegurarse de que el regulador PWM BlueSolar 48V 10A Victron es compatible con el
resto de elementos de su instalación fotovoltaica y si cubre con lo que espera. Ficha Técnica
Regulador PWM BlueSolar 48V 10A Victron Ficha Técnica Regulador PWM BlueSolar 48V 10A Victron Manual
Regulador PWM BlueSolar 48V 10A Victron",https://cdn.autosolar.es/images/reguladores-carga/regulador-pwm-bluesolar-48v-10a-lcd-usb-victron_thumb_main.jpg,,Reguladores
Regulador PWM-Pro 20A Victron BlueSolar 12/24V,"86,14"," Regulador Fotovoltaico Victron Blue Solar 20A 12/24V Descargar Manual El Regulador fotovoltaico
Victron Blue Solar 20A 12/24V es un controlador de carga de bajo coste, modulado por ancho de
pulsos, incorpora un sensor de temperatura interno. Además, el Regulador Fotovoltaico Victron Blue
Solar 20A 12/24V es capaz de cargar las baterías en tres etapas, etapa inicial, etapa de absorción y
una etapa final de flotación. El Regulador Fotovoltaico Victron Blue Solar 20A 12/24V está protegido
contra sobre corriente, contra cortocircuitos y contra la conexión inversa de paneles solares o de
baterías. Finalidad del Regulador Fotovoltaico Victron Blue Solar 20A 12/24V El Regulador
fotovoltaico Victron Blue Solar 20A 12/24V es el encargado de controlar el estado de carga de la
batería, el Regulador Fotovoltaico Victron Blue Solar 20A 12/24V se instala entre los paneles
solares y la batería dentro de la instalación solar fotovoltaica, permitiendo así tener controlada
las sobrecargas de la batería o las descargas. La finalidad del Regulador Fotovoltaico Victron Blue
Solar 20A 12/24V es proporcionar mayor durabilidad a la batería evitando hacerle descargas no
adecuadas o sobre tensiones. Composición del Regulador Fotovoltaico Victron Blue Solar 20A 12/24V El
Regulador fotovoltaico Victron Blue Solar 20A 12/24V esta construido en aluminio recubierto con
pintura negra, además incorpora luces LED que indican el estado de carga de las baterías a tiempo
real concretamente indica tres estados batería baja, batería en carga, y batería cargada. El
Regulador Fotovoltaico Victron Blue Solar 20A 12/24V ofrece dos años de garantía y una vida útil
media de ocho a 10 años. Este regulador de carga es garantía de un buen funcionamiento del sistema
fotovoltaico, además de proteger y cuidar las baterías prolongando así su vida útil Descargar Ficha
Técnica Descargar Manual",https://cdn.autosolar.es/images/reguladores-carga/regulador-pwm-pro-20a-victron-bluesolar-1224v_thumb_main.jpg,,Reguladores
Regulador Carga Steca 15A Solarix PRS1515,"86,72"," Regulador Steca 15A Solarix PRS1515 Ficha técnica del Regulador Carga Steca 15A Solarix PRS1515 Ver
Ficha Técnica del regulador Steca Steca 12V 24V 15A Solarix PRS 1010 Ver manual del del regulador
Steca Steca 12V 15A Solarix PRS1515 El regulador de carga Steca 15A Solarix PRS1515 permite conectar
controlar el estado de carga de las baterías, evitando que se descarguen profundamente. A través de
este regulador Steca podemos conectar paneles que produzcan hasta 15A. A través de sus indicadores
LED, sabremos el estado de carga de las baterías, concretamente tenemos 4 indicadores, (batería
baja, batería en carga y batería semi-llena y batería llena) con los colores rojo, amarillo y verde
respectivamente. El regulador Steca 15A Solarix, dispone de otro indicador LED que nos indica si los
paneles solares están cargando la batería en ese momento. ¿Cómo conectar el regulador Steca 15A a la
instalación solar? Primer paso: Conectar la batería. Con la polaridad correcta usaremos la pareja de
bornes del medio (con el símbolo de la batería) para los cables de conexión de la batería en el
regulador Steca. Conectar el cable de conexión de la batería A+ al polo positivo de la batería.
Conectar el cable de conexión de la batería A– al polo negativo de la batería. Si la polaridad de la
conexión es correcta, el LED info se enciende de color verde. Paso dos: Conectar el módulo solar.
Nos aseguraremos que el módulo solar no supera la corriente de entrada máxima admisible. Primero
conectar el cable de conexión del módulo solar M+ en la pareja de bornes izquierda del regulador
Steca (con el símbolo del módulo solar) con la polaridad correcta, entonces el cable M-. Paso tres:
Conectar el cable de conexión del consumidor Si usamos el consumo en corriente continua,
conectaremos este consumo en la pareja de bornes derecha (con el símbolo de la lámpara) con la
polaridad correcta. Indicaciones: si disponemos de inversor o de un cargador de baterías externo,
éste se conectará directamente sobre la batería. Además, los consumidores conectados así deben
protegerse por separado. Características del regulador Steca 15A Solarix - Regulación de tensión con
selección automática de voltaje - Regulación MAP con tecnología de carga escalonada - Desconexión de
carga en función de la corriente y reconexión automática del consumidor - Compensación de
temperatura mediante dispositivo opcional - Toma de tierra en uno o varios terminales positivos o
sólo en uno de los terminales negativos - Carga mensual de mantenimiento Funciones de protección
electrónica del regulador Steca 15A Solarix - Protección contra sobrecarga y contra descarga total -
Protección contra polaridad inversa de los módulos, la carga y la batería - Fusible electrónico
automático - Protección contra cortocircuito de la carga y los módulos solares - Protección contra
sobretensión en la entrada del módulo - Protección contra circuito abierto sin batería - Protección
contra corriente inversa por la noche - Protección contra sobretemperatura y sobrecarga -
Desconexión por sobretensión en la batería Indicaciones del regulador Steca 15A Solarix - LED de
varios colores indican los estados de funcionamiento Opciones del regulador Steca 15A Solarix -
Función de luz nocturna de fábrica o configurable por el Steca PA RC 100 - Parametrización de los
valores funcionales con el Steca PA RC 100 Certificaciones - Conforme a los estándares europeos (CE)
- Conforme a RoHS - Desarrollado y fabricado en Alemania - Fabricado conforme a ISO 9001 e ISO 14001
Videos explicativos del Regulador Carga Steca 15A Solarix PRS1515 Regulador Carga Steca 15A Solarix
PRS1515 Ficha técnica del Regulador Carga Steca 15A Solarix PRS1515 Ver Ficha Técnica del regulador
Steca Steca 12V 24V 15A Solarix PRS 1010 Ver manual del del regulador Steca Steca 12V 15A Solarix
PRS1515",https://cdn.autosolar.es/images/reguladores-carga/regulador-carga-steca-15a-solarix-prs1515_thumb_main.jpg,,Reguladores
Regulador Victron 20A PWM-Light 48V,"94,76"," Regulador Victron 20A PWM-Light 48VFicha técnica del Regulador Victron 20A PWM-Light 48VFicha
técnica del Regulador Victron 20A PWM-Light 48VManual del Regulador Victron 20A PWM-Light
48VCaracterísticas del Regulador Victron 20A PWM-Light 48VEl Regulador de carga solar Victron 20A
PWM-Light 48V es un controlador de carga para instalaciones aisladas de 48V. Es de tipo PWM, por lo
que precisaremos instalar los paneles de forma que tengamos 48V, la misma tensión a la que trabajan
las baterías. Su regulación PWM significa que tiene modulación por ancho de pulsos para realizar la
carga de una batería. El Regulador Victron 20A PWM-Light 48V es capaz de cargar las baterías en tres
etapas, etapa inicial, etapa de absorción y una etapa final de flotación. El Regulador Victron 20A
PWM-Light 48V está protegido contra sobre corriente, contra cortocircuitos y contra la conexión
inversa de paneles solares o de baterías, además incorpora un sensor de temperatura interno para
preservar su buen funcionamiento.Aplicaciones del Regulador Victron 20A PWM-Light 48VEl Regulador
Victron 20A PWM-Light 48V es el encargado de controlar el estado de carga de la batería, ya que los
controladores de carga se instalan entre los paneles solares y las baterías dentro de la instalación
solar fotovoltaica, permitiendo así tener controlada las sobrecargas de la batería y también las
descargas, siempre que utilicemos la salida de consumo que integra el propio Regulador Victron 20A
PWM-Light 48V. La finalidad de esta gama Light es proporcionar también un control sobre la salida de
consumo ya sea de modo manual o automático, ideal para controlar luces o pequeños consumos
programados. Utilizar un regulador de carga en nuestra instalación solar proporcionará mayor
durabilidad a la batería evitando hacerle descargas no adecuadas o sobre tensiones.Programación del
Regulador Victron 20A PWM-Light 48VEl Regulador Victron 20A PWM-Light 48V dispone de varias luces
LED que indican el estado de carga de las baterías a tiempo real y también el estado de la salida de
consumo. Nos indica tres estados: batería baja, batería en carga, y batería cargada. El Regulador
Victron 20A PWM-Light 48V dispone de una pequeña pantalla con 2 dígitos para poder programar la
salida de consumo en corriente continua. Se puede establecer como temporizador con desconexión
automática o bien como función luminaria para que la salida de consumo se active cuando es de noche.
Puede encontrar el modo de configurarlo en el manual adjunto. Este regulador de carga es garantía de
un buen funcionamiento del sistema fotovoltaico, además de proteger y cuidar las baterías
prolongando así su vida útilFicha técnica del Regulador Victron 20A PWM-Light 48VFicha técnica del
Regulador Victron 20A PWM-Light 48VManual del Regulador Victron 20A PWM-Light 48V",https://cdn.autosolar.es/images/reguladores-carga/regulador-victron-20a-pwm-light-48v_thumb_main.jpg,,Reguladores
Regulador Carga Steca 10A LCD PR1010,"94,86"," Regulador de Carga Steca 10A PR1010 con display LCD Ficha técnica del Regulador de Carga Steca 30A
Solarix PRS3030 Ver Ficha Técnica del Regulador de Carga Steca 12V 24V 10A PR1010 con display LCD
Ver Manual del Regulador de Carga Steca 12V 24V 10A PR1010 con display LCD El regulador de carga
Steca 10A PR1010 con display LCD permite controlar el estado de carga de las baterías, evitando que
se descarguen profundamente. A través de este regulador de carga podemos conectar paneles que
produzcan hasta 10A. Mediante su pantalla LCD, podemos saber el estado de carga de las baterías
entre otras muchas indicaciones, como si los paneles solares están cargando las baterías en ese
momento, y si las baterías están descargandose por algún consumo que tengamos encendido. Las
tecnologías de carga más modernas unidas a la determinación del estado de carga con Steca-AntonIC,
que ha sido de nuevo mejorada, forman la unidad perfecta para el cuidado y control de la batería
conectada a este regulador Steca. Mediante símbolos, un gran display informa al usuario sobre los
estados de funcionamiento. El nivel de carga se representa de forma visual con una barra indicadora.
Datos como por ejemplo la tensión, la corriente y el estado de carga se pueden visualizar también en
el display con números de forma digital. Además, el regulador dispone de un contador de energía que
el mismo usuario puede resetear. ¿Cómo conectar el regulador de carga Steca 10A a la instalación
solar? Primer paso: Conectar la batería Conectar con la polaridad correcta en la pareja de bornes
del medio (con el símbolo de la batería) los cables de conexión de la batería en el regulador de
carga. Conectar el cable de conexión de la batería A+ al polo positivo de la batería. Conectar el
cable de conexión de la batería A– al polo negativo de la batería. Si la polaridad de la conexión es
correcta la pantalla LCD se encenderá. Paso dos: Conectar el módulo solar. Asegurarse que el módulo
solar no supera la corriente de entrada máxima admisible. Primero conectar el cable de conexión del
módulo solar M+ en la pareja de bornes izquierda del regulador de carga (con el símbolo del módulo
solar) con la polaridad correcta, entonces el cable M-. Paso tres: Conectar los consumidores.
Primero conectar el cable de conexión del consumidor L+ en la pareja de bornes derecha (con el
símbolo de la lámpara) con la polaridad correcta, entonces el cable L-. Indicaciones: Aquellos
consumidores con un consumo de corriente más alto que la salida de corriente pueden conectarse
directamente a la batería, como un inversor. Sin embargo, en este caso no se activará la protección
contra descarga total del regulador de carga. Características del regulador de carga Steca 10A
PR1010 con display LCD - Determinación del estado de carga con Steca AtonIC (SOC) - Selección
automática de tensión - Regulación MAP con tecnología de carga escalonada - Desconexión de carga en
función del SOC y reconexión automática del consumidor - Compensación de temperatura mediante
complemento opcional - Toma de tierra en uno o varios terminales positivos o sólo en uno de los
terminales negativos - Registrador de datos integrado. - Carga mensual de mantenimiento - Función de
luz nocturna, vespertina y diurna. Funciones de protección electrónica del regulador de carga Steca
10A PR1010 con display LCD - Protección contra sobrecarga y contra descarga total - Protección
contra polaridad inversa de los módulos, la carga y la batería - Fusible electrónico automático -
Protección contra cortocircuito de la carga y los módulos solares - Protección contra sobretensión
en la entrada del módulo - Protección contra circuito abierto sin batería - Protección contra
corriente inversa por la noche - Protección contra sobretemperatura y sobrecarga - Desconexión por
sobretensión en la batería Indicaciones del regulador de carga Steca 10A PR1010 con display LCD -
Display LED multifuncional con 4 botones de programación y configuración. Certificaciones Conforme a
los estándares europeos (CE) Conforme a RoHS Desarrollado y fabricado en Alemania Fabricado conforme
a ISO 9001 e ISO 14001 Ficha técnica del Regulador de Carga Steca 30A Solarix PRS3030 Ver Ficha
Técnica del Regulador de Carga Steca 12V 24V 10A PR1010 con display LCD Ver Manual del Regulador de
Carga Steca 12V 24V 10A PR1010 con display LCD",https://cdn.autosolar.es/images/reguladores-carga/regulador-carga-steca-10a-lcd-pr1010_thumb_main.jpg,,Reguladores
Regulador Carga Steca 20A Solarix PRS2020,"96,80"," Regulador de Carga Steca 20A Solarix PRS2020 Ficha técnica del Regulador Carga Steca 20A Solarix
PRS2020 Ver Ficha Técnica del Regulador de Carga Steca 12V 24V 20A Solarix PRS 1010 Ver manual del
regulador de carga Steca 12V 20A Solarix PRS2020 El regulador de carga Steca 20A Solarix PRS2020
permite controlar el estado de carga de las baterías, evitando que se descarguen profundamente. A
través de este regulador de carga podemos conectar paneles que produzcan hasta 20A. Mediante sus
indicadores LED, podemos saber el estado de carga de las baterías, concretamente tenemos 4
indicadores, (batería baja, batería en carga y batería semi-llena y batería llena) con los colores
rojo, amarillo y verde respectivamente. El regulador Steca 20A Solarix, dispone de otro indicador
LED que nos indica si los paneles solares están cargando la batería en ese momento. ¿Cómo conectar
el regulador Steca 20A a la instalación solar? Primer paso: Conectar la batería. Con la polaridad
correcta usaremos la pareja de bornes del medio (con el símbolo de la batería) para los cables de
conexión de la batería en el regulador Steca 20A. Conectar el cable de conexión de la batería A+ al
polo positivo de la batería. Conectar el cable de conexión de la batería A– al polo negativo de la
batería. Si la polaridad de la conexión es correcta, el LED info se enciende de color verde. Paso
dos: Conectar el módulo solar. Nos aseguraremos que el módulo solar no supera la corriente de
entrada máxima admisible. Primero conectar el cable de conexión del módulo solar M+ en la pareja de
bornes izquierda del regulador Steca 20A (con el símbolo del módulo solar) con la polaridad
correcta, entonces el cable M-. Paso tres: Conectar el cable de conexión del consumidor Si usamos el
consumo en corriente continua, conectaremos este consumo en la pareja de bornes derecha (con el
símbolo de la lámpara) con la polaridad correcta. Indicaciones: si disponemos de inversor o de un
cargador de baterías externo, éste se conectará directamente sobre la batería. Además, los
consumidores conectados así deben protegerse por separado. Características del regulador Steca 20A
Solarix - Regulación de tensión con selección automática de voltaje - Regulación MAP con tecnología
de carga escalonada - Desconexión de carga en función de la corriente y reconexión automática del
consumidor - Compensación de temperatura mediante dispositivo opcional - Toma de tierra en uno o
varios terminales positivos o sólo en uno de los terminales negativos - Carga mensual de
mantenimiento Funciones de protección electrónica del regulador Steca 20A Solarix - Protección
contra sobrecarga y contra descarga total - Protección contra polaridad inversa de los módulos, la
carga y la batería - Fusible electrónico automático - Protección contra cortocircuito de la carga y
los módulos solares - Protección contra sobretensión en la entrada del módulo - Protección contra
circuito abierto sin batería - Protección contra corriente inversa por la noche - Protección contra
sobretemperatura y sobrecarga - Desconexión por sobretensión en la batería Indicaciones del
regulador Steca 20A Solarix - LED de varios colores indican los estados de funcionamiento Opciones
del regulador Steca 20A Solarix - Función de luz nocturna de fábrica o configurable por el Steca PA
RC 100 - Parametrización de los valores funcionales con el Steca PA RC 100 Certificaciones -
Conforme a los estándares europeos (CE) - Conforme a RoHS - Desarrollado y fabricado en Alemania -
Fabricado conforme a ISO 9001 e ISO 14001 Videos explicativos del Regulador Carga Steca 20A Solarix
PRS2020 Regulador Carga Steca 20A Solarix PRS2020 Ficha técnica del Regulador Carga Steca 20A
Solarix PRS2020 Ver Ficha Técnica del Regulador de Carga Steca 12V 24V 20A Solarix PRS 1010 Ver
manual del regulador de carga Steca 12V 20A Solarix PRS2020",https://cdn.autosolar.es/images/reguladores-carga/regulador-carga-steca-20a-solarix-prs2020_thumb_main.jpg,,Reguladores
