title,cost,description,img_src,photo_desc_str,category
Regulador Convertidor SRNE 12V 30A,"353,84"," Regulador Convertidor SRNE 12V 30A Ficha Técnica Regulador Convertidor SRNE 12V 30A Ficha Técnica
del Regulador Convertidor SRNE 12V 30A Características técnicas del Regulador Convertidor SRNE 12V
30A Este regulador MPPT está listo para funcionar sobre instalaciones solares fotovoltaicas
adimitiendo un máximo de 30A de carga máxima a baterías y una potencia de entrada fotovoltaica de
400W. Esta gama de modelos SRNE se caracteriza por trabajar en instalaciones de 12V y cuentan con
detección automática de la tensión de trabajo. También cuenta con eficiencia del seguidor MPPT
superior al 99% contando además con bajo consumo de apenas 0.6W de consumo propio. Este regulador
convertidor hace trabajar el panel en su punto óptimo donde la relación entre voltaje e intensidad
es máxima para así adaptarse a las mejores condiciones lumínicas de cada momento. Incorpora también
un algoritmo de carga multi-etapas para asegurarnos de un óptimo cuidado de la batería, pudiendo ser
ésta de tecnología de litio o de plomo. Los modos de trabajo de carga se dividen en carga
fotovoltaica, batería de respaldo, carga del generador batería de respaldo, PV y carga del generador
batería de respaldo y PV carga la batería de arranque. Admite carga de control de interruptor remoto
externo. Asimismo, incorpora una pantalla LCD sobre el propio chasis del regulador, para poder
monitorizar in-situ la instalación. Además, incorpora también conectividad Bluetooth para realizar
la configuración y poder ver su funcionamiento desde nuestro Smartphone dentro del rango de alcance
de este tipo de conectividad inalámbrica. Aspectos técnicos del Regulador Convertidor SRNE 12V 30A
Corriente de carga nominal: 30A Voltaje máximo de entrada: 50VDC Corriente máxima de entrada: 27A
Eficiencia MPPT: mayor que 99% Tipo de batería de arranque: Batería de ácido sólido Potencia de
entrada recomendada: 400W Eficiencia máxima de conversión de carga: 98% Pérdida de carga: menos de
0.6W Dimensiones: 221 x 175.8 x 82.4 mm Grado de protección: IP32 Instalación del Regulador
Convertidor SRNE 12V 30A La instalación de este regulador MPPT es muy fácil y accesible, no obstante
desde AutoSolar se recomienda que lea detenidamente las instrucciones para su instalación y
manipulación. Ante cualquier duda consúltenos para asegurarnos de que se realiza de modo correcto.
También le aconsejamos que consulte el manual del fabricante, que recibirá junto con su regulador
MPPT ya que cualquier negligencia por motivo de una instalación incorrecta, manipulación indebida o
uso inadecuado anula la garantía del producto. Conectividad del Bluetooth Regulador Convertidor SRNE
12V 30A Este regulador MPPT dispone de doble tipo de monitorización, por un lado la pantalla LCD
sobre la propia superficie del regulador y además conectividad Bluetooth para poderlo configurar y
monitorizar de un modo más cómodo desde nuestro teléfono móvil. El bluetooth está integrado, por lo
que no es necesario adquirir ningún componente adicional por separado. Gracias a la interfaz
bluetooth, desde nuestro teléfono móvil, mediante la aplicación del fabricante podremos realizar
multitud de operaciones, tales como: - Visualizar los parámetros en tiempo real del regulador y
también los datos históricos de producción, muy útil si no tenemos una visión directa con la propia
pantalla que incorpora el regulador. - Cambiar la configuración del tipo de batería entre los modos
predefinidos, pudiendo establecer parámetros de carga personalizados. - Comprobar temperatura y una
capacidad estimada de la batería. Ficha Técnica Regulador Convertidor SRNE 12V 30A Ficha Técnica del
Regulador Convertidor SRNE 12V 30A",https://cdn.autosolar.es/images/reguladores-carga/regulador-convertidor-srne-12v-30a_thumb_main.jpg,,Reguladores
Regulador Convertidor SRNE 12V 50A,"427,57"," Regulador Convertidor SRNE 12V 50A Ficha Técnica del Regulador Convertidor SRNE 12V 50A Ficha
Técnica del Regulador Convertidor SRNE 12V 50A Descripción del Regulador Convertidor SRNE 12V 50A
Este regulador MPPT está listo para funcionar sobre instalaciones solares fotovoltaicas adimitiendo
un máximo de 50A de carga máxima a baterías y una potencia de entrada fotovoltaica de 700W. Esta
gama de modelos SRNE se caracteriza por trabajar en instalaciones de 12V y cuentan con detección
automática de la tensión de trabajo. También cuenta con eficiencia del seguidor MPPT superior al 99%
contando además con bajo consumo de apenas 0.6W de consumo propio. Este regulador convertidor hace
trabajar al panel en su punto óptimo donde la relación entre voltaje e intensidad es máxima para así
adaptarse a las mejores condiciones lumínicas de cada momento. Incorpora también un algoritmo de
carga multi-etapas para asegurarnos de un óptimo cuidado de la batería, pudiendo ser ésta de
tecnología de litio o de plomo. Los modos de trabajo de carga se dividen en carga fotovoltaica,
batería de respaldo, carga del generador batería de respaldo, PV y carga del generador batería de
respaldo y PV carga la batería de arranque. Admite carga de control de interruptor remoto externo.
Asimismo, incorpora una pantalla LCD sobre el propio chasis del regulador, para poder monitorizar
in-situ la instalación. Además, incorpora también conectividad Bluetooth para realizar la
configuración y poder ver su funcionamiento desde nuestro smartphone dentro del rango de alcance de
este tipo de conectividad inalámbrica. Aspectos Técnicos del Regulador Convertidor SRNE 12V 50A
Corriente de carga nominal: 50A Voltaje máximo de entrada: 50VDC Corriente máxima de entrada: 45A
Eficiencia MPPT: mayor que 99% Tipo de batería de arranque: Batería de ácido sólido Potencia de
entrada recomendada: 700W Eficiencia máxima de conversión de carga: mayor que 99% Pérdida de carga:
menos de 0.6W Dimensiones: 221 x 175.8 x 82.4 mm Grado de protección: IP32 Instalación del Regulador
Convertidor SRNE 12V 50A La instalación de este regulador MPPT es muy fácil y accesible, no obstante
desde AutoSolar se recomienda que lea detenidamente las instrucciones para su instalación y
manipulación. Ante cualquier duda consúltenos para asegurarnos de que se realiza de modo correcto.
También le aconsejamos que consulte el manual del fabricante, que recibirá junto con su regulador
MPPT ya que cualquier negligencia por motivo de una instalación incorrecta, manipulación indebida o
uso inadecuado anula la garantía del producto. Conectividad Bluetooth Regulador Convertidor SRNE 12V
50A Este regulador MPPT dispone de doble tipo de monitorización, por un lado la pantalla LCD sobre
la propia superficie del regulador y además conectividad Bluetooth para poderlo configurar y
monitorizar de un modo más cómodo desde nuestro teléfono móvil. El bluetooth está integrado, por lo
que no es necesario adquirir ningún componente adicional por separado. Gracias a la interfaz
bluetooth, desde nuestro teléfono móvil, mediante la aplicación del fabricante podremos realizar
multitud de operaciones, tales como: - Visualizar los parámetros en tiempo real del regulador y
también los datos históricos de producción, muy útil si no tenemos una visión directa con la propia
pantalla que incorpora el regulador. - Cambiar la configuración del tipo de batería entre los modos
predefinidos, pudiendo establecer parámetros de carga personalizados. - Comprobar temperatura y una
capacidad estimada de la batería. Ficha Técnica del Regulador Convertidor SRNE 12V 50A Ficha Técnica
del Regulador Convertidor SRNE 12V 50A",https://cdn.autosolar.es/images/reguladores-carga/regulador-convertidor-srne-12v-50a_thumb_main.jpg,,Reguladores
Regulador MPPT 150V 85A LCD 12/24/48V,"447,70"," Regulador MPPT 150V 85A LCD 12/24/48V Ficha técnica y Manual del Regulador MPPT 150V 85A LCD
12/24/48V Ver la Ficha Técnica del Regulador MPPT 150V 85A LCD 12/24/48V Ver Manual del Regulador
MPPT 150V 85A LCD 12/24/48V Características técnicas Regulador MPPT 150V 85A LCD 12/24/48V Este
Regulador MPPT está preparado para instalaciones solares fotovoltaicas y admite un máximo de 85A de
carga máxima a baterías.. Una de las mejores características de esta gama de modelos es su capacidad
para trabajar en instalaciones de 12V, 24V o 48V y con detección de la tensión de trabajo. La
eficiencia del seguidor MPPT que incorpora el Regulador MPPT 150V 85A LCD 12/24/48V es superior al
99% contando además con un consumo bajo de apenas 0.5W de consumo estático. Incorpora un algoritmo
de seguimiento de la máxima potencia que ofrece hasta un 30% más de producción que un regulador PWM
de una potencia equivalente. El Regulador MPPT 150V 85A LCD 12/24/48V hace trabajar el panel en su
punto óptimo donde la relación entre voltaje e intensidad es máxima para así adaptarse a las mejores
condiciones lumínicas de cada momento. Su algoritmo de carga multi-etapas nos asegurará un óptimo
cuidado de la batería, pudiendo ser ésta de tecnología de litio o de plomo. El Regulador MPPT 150V
85A LCD 12/24/48V incorpora pantalla LCD sobre el propio chasis del regulador, para poder
monitorizar in-situ la instalación y también conectividad Bluetooth para realizar la configuración y
poder ver su funcionamiento desde nuestro Smartphone dentro del rango de trabajo de esta
conectividad inalámbrica. Conexiones del Regulador MPPT 150V 85A LCD 12/24/48V 1- Pantalla LCD.2-
Módulo de bluetooth 4.0.3- Conexión cable positivo de batería.4- Conexión cable negativo de
batería.5- Conexión cable negativo de paneles.6- Conexión cable positivo de paneles.7-
Comunicaciones RS485.8- Llave.9- Comunicaciones TTL.10- Conexión sonda temperatura baterías.11-
Conexión sensor voltaje de baterías.12- Salida de relé. Protecciones Regulador MPPT 150V 85A LCD
12/24/48V Entre otros extras, el Regulador MPPT 150V 85A LCD 12/24/48V cuenta con las siguientes
protecciones: - Polaridad inversa en el campo fotovoltaico. El regulador se desconecta cuando la
corriente circula en sentido inverso. - Cortocircuito en la entrada fotovoltaica. Se restablece su
funcionamiento cuando el cortocircuito se subsana. - Sobrecarga. Cuando se excede la potencia máxima
admitida por el regulador, la producción se limita a la capacidad máxima de cada modelo, en este
caso 85A. - Polaridad inversa de batería. Si la corriente de baterías circula en sentido inverso, el
regulador también se protege y se restablece. Potencia de paneles con Regulador MPPT 150V 85A LCD
12/24/48V En función de la tensión de trabajo de baterías, tenemos limitaciones con laPotencia
máxima fotovoltaica que el Regulador MPPT 150V 85A LCD 12/24/48V puede convertir en energía para
cargarlas: - A 12V: 1100W de potencia FV. - A 24V: 2200W de potencia FV. - A 48V: 4400W de potencia
FV. 1- Lo primero que hay que hacer es conectar el cable positivo de alimentación de la batería.
Primero lo conectamos en el regulador y posteriormente sobre el borne de la batería. Hay que
utilizar la sección adecuada a la potencia de este regulador, cuyo chasis permite poderle conectar
cableado de hasta 35 mm de sección. Se aconseja utilizar cable solar con doble recubrimiento y
estañado para obtener el mejor rendimiento. 2- Lo segundo que hay que conectar es el cable negativo
hacia la batería. Al igual que con el cable positivo, para prevenir que se toquen accidentalmente,
primero introducir el cable en el conector del regulador y posteriormente hacer la conexión sobre el
borne de la batería. En este punto el regulador ya está activo y podremos ver en su pantalla el
estado en el que se encuentra y configurarlo vía bluetooth. 3- Seguidamente podemos conectar el
cable positivo que nos llega desde los paneles. Nos aseguramos de que sea el extremo adecuado,
aunque tengamos protección por polaridad inversa, debemos conectar el cable correcto. 4- Por último
conectamos el cable negativo que nos llega desde los paneles. Una vez completado este paso, podremos
ver como en la pantalla aparece el flujo de energía hacia las baterías realizando la carga que hemos
configurado. Para la desconexión, se recomienda seguir el orden inverso y así realizar este proceso
con seguridad para el buen funcionamiento del regulador. Conectividad Bluetooth Regulador MPPT 150V
85A LCD 12/24/48V Este regulador MPPT dispone de doble tipo de monitorización, por un lado la
pantalla LCD sobre la propia superficie del regulador y además conectividad Bluetooth para poderlo
configurar y monitorizar de un modo más cómodo desde nuestro teléfono móvil. El bluetooth está
integrado, por lo que no es necesario adquirir ningún componente adicional por separado. Gracias a
la interfaz bluetooth, desde nuestro teléfono móvil, mediante la aplicación del fabricante podremos
realizar multitud de operaciones, tales como: - Visualizar los parámetros en tiempo real del
regulador y también los datos históricos de producción, muy útil si no tenemos una visual directa
con la propia pantalla que incorpora el regulador. - Cambiar la configuración del tipo de batería
entre los modos predefinidos, pudiendo establecer parámetros de carga personalizados. - Comprobar
temperatura y una capacidad estimada de la batería. Instalación Regulador MPPT 150V 85A LCD
12/24/48V La instalación de este regulador MPPT es muy sencilla, no obstante desde AutoSolar se
recomienda que siga detenidamente las instrucciones para su instalación y manipulación. Ante
cualquier duda consúltenos para asegurarnos de que se realiza de modo correcto. Le recomendamos
encarecidamente que consulte el manual del fabricante, que recibirá junto con su regulador MPPT.
Cualquier negligencia por motivo de una instalación incorrecta, manipulación indebida o uso
inadecuado anula la garantía del producto. Precio Regulador MPPT 150V 85A LCD 12/24/48V El precio
del Regulador MPPT 150V 85A LCD 12/24/48V de AutoSolar incluye garantía de fabricante, respaldo
técnico durante su vida útil y asesoramiento gratuito. Regulador MPPT 150V 85A LCD 12/24/48V al
mejor precio El Regulador MPPT 150V 85A LCD 12/24/48V al mejor precio cuenta con garantía de
fabricante y servicio de atención personalizada profesional. Confíe únicamente en aquellas empresas
que le ofrecen todas las garantías y trabajan con los mejores fabricantes internacionales. Este
Regulador MPPT está fabricado por SRNE Solar; un fabricante de primer nivel que ofrece una excelente
relación calidad-precio. Sólo en AutoSolar podrá adquirir el Regulador MPPT 150V 85A LCD 12/24/48V.
Ficha técnica y Manual del Regulador MPPT 150V 85A LCD 12/24/48V Ver la Ficha Técnica del Regulador
MPPT 150V 85A LCD 12/24/48V Ver Manual del Regulador MPPT 150V 85A LCD 12/24/48V AutoSolar queda a
su disposición para asesorarle sobre el Regulador MPPT 150V 85A LCD 12/24/48V al mejor precio o
cualquiera de los productos de nuestra página web, contáctenos para más información.",https://cdn.autosolar.es/images/reguladores-carga/regulador-mppt-150v-85a-lcd-122448v_thumb_main.jpg,,Reguladores
Regulador MPPT 250V 85A LCD 12/24/48V,"481,69"," Regulador MPPT 250V 85A LCD 12/24/48V Ficha técnica del Regulador MPPT 250V 85A LCD 12/24/48V Ver
la Ficha Técnica del Regulador MPPT 250V 85A LCD 12/24/48V Ver Manual del Regulador MPPT 250V 85A
LCD 12/24/48V Características técnicas Regulador MPPT 250V 85A LCD 12/24/48V Este Regulador MPPT
está preparado para instalaciones solares fotovoltaicas y admite un máximo de 85A de carga máxima a
baterías.. Una de las mejores características de esta gama de modelos es su capacidad para trabajar
en instalaciones de 12V, 24V o 48V y con detección de la tensión de trabajo. La eficiencia del
seguidor MPPT que incorpora el Regulador MPPT 250V 85A LCD 12/24/48V es superior al 99% contando
además con un consumo bajo de apenas 0.5W de consumo estático. Incorpora un algoritmo de seguimiento
de la máxima potencia que ofrece hasta un 30% más de producción que un regulador PWM de una potencia
equivalente. El Regulador MPPT 250V 85A LCD 12/24/48V hace trabajar el panel en su punto óptimo
donde la relación entre voltaje e intensidad es máxima para así adaptarse a las mejores condiciones
lumínicas de cada momento. Su algoritmo de carga multi-etapas nos asegurará un óptimo cuidado de la
batería, pudiendo ser ésta de tecnología de litio o de plomo. El Regulador MPPT 250V 85A LCD
12/24/48V incorpora pantalla LCD sobre el propio chasis del regulador, para poder monitorizar
in-situ la instalación y también conectividad Bluetooth para realizar la configuración y poder ver
su funcionamiento desde nuestro Smartphone dentro del rango de trabajo de esta conectividad
inalámbrica. Regulador MPPT de 250V Una de las grandes ventajas de utilizar un Regulador MPPT 250V
85A LCD 12/24/48V es la posibilidad de diseñar sistemas fotovoltaicos que trabajen a un voltaje más
elevado de paneles. Una de las principales pérdidas de los sistemas fotovoltaicos clásicos de
aislada son las elevadas intensidades de trabajo de los campos fotovoltaicos. Utilizando un
regulador de carga que admite trabajar hasta 250V en circuito abierto podremos diseñar un sistema
solar con la misma capacidad de carga pero con inferior intensidad gracias a su superior voltaje. En
un sistema con un regulador MPPT de 150V, si utilizamos paneles de 60 células normales del entorno
de los 280W, se aconsejan conectarlos por tríos, sin embargo gracias a este modelo capaz de trabajar
hasta con 250V, se podrían conectar en series de 5 o incluso 6 en función de la tensión máxima del
panel solar. Conexiones del Regulador MPPT 250V 85A LCD 12/24/48V 1- Pantalla LCD.2- Módulo de
bluetooth 4.0.3- Conexión cable positivo de batería.4- Conexión cable negativo de batería.5-
Conexión cable negativo de paneles.6- Conexión cable positivo de paneles.7- Comunicaciones RS485.8-
Llave.9- Comunicaciones TTL.10- Conexión sonda temperatura baterías.11- Conexión sensor voltaje de
baterías.12- Salida de relé. Protecciones Regulador MPPT 250V 85A LCD 12/24/48V Entre otros extras,
el Regulador MPPT 250V 85A LCD 12/24/48V cuenta con las siguientes protecciones: - Polaridad inversa
en el campo fotovoltaico. El regulador se desconecta cuando la corriente circula en sentido inverso.
- Cortocircuito en la entrada fotovoltaica. Se restablece su funcionamiento cuando el cortocircuito
se subsana. - Sobrecarga. Cuando se excede la potencia máxima admitida por el regulador, la
producción se limita a la capacidad máxima de cada modelo, en este caso 85A. - Polaridad inversa de
batería. Si la corriente de baterías circula en sentido inverso, el regulador también se protege y
se restablece. Potencia de paneles con Regulador MPPT 250V 85A LCD 12/24/48V En función de la
tensión de trabajo de baterías, tenemos limitaciones con laPotencia máxima fotovoltaica que el
Regulador MPPT 250V 85A LCD 12/24/48V puede convertir en energía para cargarlas: - A 12V: 1100W de
potencia FV. - A 24V: 2200W de potencia FV. - A 48V: 4400W de potencia FV. 1- Lo primero que hay que
hacer es conectar el cable positivo de alimentación de la batería. Primero lo conectamos en el
regulador y posteriormente sobre el borne de la batería. Hay que utilizar la sección adecuada a la
potencia de este regulador, cuyo chasis permite poderle conectar cableado de hasta 35 mm de sección.
Se aconseja utilizar cable solar con doble recubrimiento y estañado para obtener el mejor
rendimiento. 2- Lo segundo que hay que conectar es el cable negativo hacia la batería. Al igual que
con el cable positivo, para prevenir que se toquen accidentalmente, primero introducir el cable en
el conector del regulador y posteriormente hacer la conexión sobre el borne de la batería. En este
punto el regulador ya está activo y podremos ver en su pantalla el estado en el que se encuentra y
configurarlo vía bluetooth. 3- Seguidamente podemos conectar el cable positivo que nos llega desde
los paneles. Nos aseguramos de que sea el extremo adecuado, aunque tengamos protección por polaridad
inversa, debemos conectar el cable correcto. 4- Por último conectamos el cable negativo que nos
llega desde los paneles. Una vez completado este paso, podremos ver como en la pantalla aparece el
flujo de energía hacia las baterías realizando la carga que hemos configurado. Para la desconexión,
se recomienda seguir el orden inverso y así realizar este proceso con seguridad para el buen
funcionamiento del regulador. Conectividad Bluetooth Regulador MPPT 250V 85A LCD 12/24/48V Este
regulador MPPT dispone de doble tipo de monitorización, por un lado la pantalla LCD sobre la propia
superficie del regulador y además conectividad Bluetooth para poderlo configurar y monitorizar de un
modo más cómodo desde nuestro teléfono móvil. El bluetooth está integrado, por lo que no es
necesario adquirir ningún componente adicional por separado . Gracias a la interfaz bluetooth, desde
nuestro teléfono móvil, mediante la aplicación del fabricante podremos realizar multitud de
operaciones, tales como: - Visualizar los parámetros en tiempo real del regulador y también los
datos históricos de producción, muy útil si no tenemos una visual directa con la propia pantalla que
incorpora el regulador. - Cambiar la configuración del tipo de batería entre los modos predefinidos,
pudiendo establecer parámetros de carga personalizados. - Comprobar temperatura y una capacidad
estimada de la batería. Instalación Regulador MPPT 250V 85A LCD 12/24/48V La instalación de este
regulador MPPT es muy sencilla, no obstante desde AutoSolar se recomienda que siga detenidamente las
instrucciones para su instalación y manipulación. Ante cualquier duda consúltenos para asegurarnos
de que se realiza de modo correcto. Le recomendamos encarecidamente que consulte el manual del
fabricante, que recibirá junto con su regulador MPPT. Cualquier negligencia por motivo de una
instalación incorrecta, manipulación indebida o uso inadecuado anula la garantía del producto.
Precio Regulador MPPT 250V 85A LCD 12/24/48V El precio del Regulador MPPT 250V 85A LCD 12/24/48V de
AutoSolar incluye garantía de fabricante, respaldo técnico durante su vida útil y asesoramiento
gratuito. Regulador MPPT 250V 85A LCD 12/24/48V al mejor precio El Regulador MPPT 250V 85A LCD
12/24/48V al mejor precio cuenta con garantía de fabricante y servicio de atención personalizada
profesional. Confíe únicamente en aquellas empresas que le ofrecen todas las garantías y trabajan
con los mejores fabricantes internacionales. Este Regulador MPPT está fabricado por SRNE Solar; un
fabricante de primer nivel que ofrece una excelente relación calidad-precio. Sólo en AutoSolar podrá
adquirir el Regulador MPPT 250V 85A LCD 12/24/48V. Ficha técnica del Regulador MPPT 250V 85A LCD
12/24/48V Ver la Ficha Técnica del Regulador MPPT 250V 85A LCD 12/24/48V Ver Manual del Regulador
MPPT 250V 85A LCD 12/24/48V AutoSolar queda a su disposición para asesorarle sobre el Regulador MPPT
250V 85A LCD 12/24/48V al mejor precio o cualquiera de los productos de nuestra página web,
contáctenos para más información.",https://cdn.autosolar.es/images/reguladores-carga/regulador-mppt-250v-85a-lcd-122448v_thumb_main.jpg,,Reguladores
Pantalla LCD Regulador MPPT 12/24V SR-MC RM-6,"17,15"," Pantalla LCD Regulador MPPT 12/24V SR-MC Ficha técnica y manual de la Pantalla LCD Regulador MPPT
12/24V SR-MC Ver la Ficha Técnica de la Pantalla LCD Regulador MPPT 12/24V SR-MC Ver Manual de la
Pantalla LCD Regulador MPPT 12/24V SR-MC Características técnicas Pantalla LCD Regulador MPPT 12/24V
SR-MC Para los reguladores MPPT de la serie MC, está como opción esta pantalla de visualización que
nos permite monitorizar y configurar de modo sencillo el funcionamiento del regulador MPPT. Entre
las opciones disponibles de la pantalla encontramos las siguientes: - Ver el estado actual de la
instalación en tiempo real. - Realizar configuraciones sobre las opciones de carga del regulador, en
función de la tecnología de baterías de que dispongamos. - Ver alarmas y errores de funcionamiento
de un modo sencillo y directo. Información de la Pantalla LCD Regulador MPPT 12/24V SR-MC Gracias a
la integración que nos ofrece el fabricante, tendremos en una pantalla disponible para visualizar
directamente el funcionamiento de los reguladores de la gama SR-MC, que no disponen de pantalla
incorporada al mismo. Esta pantalla LCD para Regulador MPPT puede funcionar con los modelos de
12/24V de 20A, 30A, 40A y 50A. Simplemente conectando el cableado de la pantalla, ésta recibe
alimentación del propio regulador e inmediatamente nos muestra el estado de funcionamiento. Dispone
de 2 botones en su derecha para poder realizar cambios de pantalla y ajustes sobre el funcionamiento
del propio regulador. Ficha técnica y manual de la Pantalla LCD Regulador MPPT 12/24V SR-MC Ver la
Ficha Técnica de la Pantalla LCD Regulador MPPT 12/24V SR-MC Ver Manual de la Pantalla LCD Regulador
MPPT 12/24V SR-MC",https://cdn.autosolar.es/images/accesorios-reguladores-carga/pantalla-lcd-regulador-mppt-1224v-sr-mc-rm-6_thumb_main.jpg,,Reguladores
